<?xml version="1.0" encoding="UTF-8"?>
<xs:schema xmlns:xs="http://www.w3.org/2001/XMLSchema">

    <xs:element name="registro_logistica">
        <xs:complexType>
            <xs:sequence>
                <xs:element name="paquete" minOccurs="3" maxOccurs="unbounded">
                    <xs:complexType>
                        <xs:sequence>
                            <xs:element name="remitente" type="xs:string" />

                            <xs:element name="peso_kg">
                                <xs:simpleType>
                                    <xs:restriction base="xs:decimal">
                                        <xs:minInclusive value="0.1" />
                                        <xs:maxInclusive value="50.0" />
                                    </xs:restriction>
                                </xs:simpleType>
                            </xs:element>

                            <xs:element name="entregado" type="xs:boolean" />
                            <xs:element name="fecha_admision" type="xs:date" />

                            <xs:element name="coordenadas_gps">
                                <xs:simpleType>
                                    <xs:restriction base="xs:string">
                                        <xs:pattern
                                            value="-?[0-9]{1,2}\.[0-9]+,-?[0-9]{1,3}\.[0-9]+" />
                                    </xs:restriction>
                                </xs:simpleType>
                            </xs:element>

                            <xs:element name="historial">
                                <xs:complexType>
                                    <xs:sequence>
                                        <xs:element name="evento" minOccurs="1"
                                            maxOccurs="unbounded">
                                            <xs:complexType>
                                                <xs:simpleContent>
                                                    <xs:extension base="xs:string">
                                                        <xs:attribute name="hora" type="xs:dateTime"
                                                            use="required" />
                                                    </xs:extension>
                                                </xs:simpleContent>
                                            </xs:complexType>
                                        </xs:element>
                                    </xs:sequence>
                                </xs:complexType>
                            </xs:element>

                        </xs:sequence>

                        <xs:attribute name="id" use="required">
                            <xs:simpleType>
                                <xs:restriction base="xs:string">
                                    <xs:pattern value="[A-Z]{3}-[0-9]{3}" />
                                </xs:restriction>
                            </xs:simpleType>
                        </xs:attribute>

                        <xs:attribute name="urgencia" use="required">
                            <xs:simpleType>
                                <xs:restriction base="xs:string">
                                    <xs:enumeration value="Express" />
                                    <xs:enumeration value="Standard" />
                                    <xs:enumeration value="BajoCoste" />
                                </xs:restriction>
                            </xs:simpleType>
                        </xs:attribute>

                    </xs:complexType>
                </xs:element>
            </xs:sequence>
        </xs:complexType>
    </xs:element>

</xs:schema>