<?xml version="1.0" encoding="UTF-8"?>
<registro_logistica
    xmlns:xsi="http://www.w3.org/2001/XMLSchema-instance"
    xsi:noNamespaceSchemaLocation="validacion.xsd">

    <paquete id="SEV-001" urgencia="Express">
        <remitente>Empresa Andaluza SL</remitente>
        <peso_kg>2.5</peso_kg>
        <entregado>true</entregado>
        <fecha_admision>2025-01-10</fecha_admision>
    </paquete>

    <paquete id="MAD-245" urgencia="Standard">
        <remitente>Logística Central</remitente>
        <peso_kg>15.0</peso_kg>
        <entregado>false</entregado>
        <fecha_admision>2025-01-12</fecha_admision>
    </paquete>

    <paquete id="BCN-999" urgencia="BajoCoste">
        <remitente>Juan Pérez</remitente>
        <peso_kg>0.8</peso_kg>
        <entregado>true</entregado>
        <fecha_admision>2025-01-15</fecha_admision>
    </paquete>

</registro_logistica>